source,author,title,description,url,urlToImage,publishedAt,content,label,text,length,tokens,num_tokens
"{'id': 'next-big-future', 'name': 'Next Big Future'}",Brian Wang,Why is Tesla FSD a Big Deal Even Before Robotaxi?,Every Tesla FSD sale even with the price cuts is $8000 per car or $99 per month. The $99 per month is $1200 per year or $7200 for six years. Tesla has the highest profit per car of all car makers at $7000 per car. This is why Tesla FSD before robotaxi is a bi…,https://www.nextbigfuture.com/2024/04/why-is-tesla-fsd-a-big-deal-even-before-robotaxi.html,https://nextbigfuture.s3.amazonaws.com/uploads/2024/04/Screen-Shot-2024-04-29-at-9.49.16-AM.jpg,2024-04-29T16:51:23Z,Every Tesla FSD sale even with the price cuts is $8000 per car or $99 per month. The $99 per month is $1200 per year or $7200 for six years. Tesla has the highest profit per car of all car makers at … [+3750 chars],tesla,Why is Tesla FSD a Big Deal Even Before Robotaxi? Every Tesla FSD sale even with the price cuts is $8000 per car or $99 per month. The $99 per month is $1200 per year or $7200 for six years. Tesla has the highest profit per car of all car makers at $7000 per car. This is why Tesla FSD before robotaxi is a bi…,310.0,"['fsd', 'big', 'deal', 'even', 'robotaxi', 'every', 'fsd', 'sale', 'even', 'price', 'cuts', 'per', 'car', 'per', 'month', 'per', 'month', 'per', 'year', 'six', 'years', 'highest', 'profit', 'per', 'car', 'car', 'makers', 'per', 'car', 'fsd', 'robotaxi', 'bi']",32
"{'id': 'next-big-future', 'name': 'Next Big Future'}",Brian Wang,Tesla Has 400 Exaflops of AI Training Compute,"I talked with Herbert Ong about Tesla compute and how I believed Tesla had 100,000 H100 ordered. I only wondered if they were installed and operating. I also told Herbert that I expected large Nvidia B200 orders by Tesla and XAI so that they each add another …",https://www.nextbigfuture.com/2024/04/tesla-has-400-exaflops-of-ai-training-compute.html,https://nextbigfuture.s3.amazonaws.com/uploads/2024/04/Screen-Shot-2024-04-19-at-11.26.50-PM-1-1024x614.jpg,2024-04-20T06:34:53Z,"I talked with Herbert Ong about Tesla compute and how I believed Tesla had 100,000 H100 ordered. I only wondered if they were installed and operating.
I also told Herbert that I expected large Nvidi… [+1775 chars]",tesla,"Tesla Has 400 Exaflops of AI Training Compute I talked with Herbert Ong about Tesla compute and how I believed Tesla had 100,000 H100 ordered. I only wondered if they were installed and operating. I also told Herbert that I expected large Nvidia B200 orders by Tesla and XAI so that they each add another …",306.0,"['exaflops', 'ai', 'training', 'compute', 'talked', 'herbert', 'ong', 'compute', 'believed', 'h100', 'ordered', 'wondered', 'installed', 'operating', 'also', 'told', 'herbert', 'expected', 'large', 'nvidia', 'b200', 'orders', 'xai', 'add', 'another']",25
"{'id': 'next-big-future', 'name': 'Next Big Future'}",Brian Wang,Future Tesla FSD Will Merge and Expand with XAI Grok,"Future versions of Tesla FSD will likely merge with XAI Grok. While Elon Musk has expressed concerns about building too much of his new AI ideas into Tesla unless he has 25% voting control, the need to make a competitive AI will force Tesla FSD to work with X…",https://www.nextbigfuture.com/2024/04/future-tesla-fsd-will-merge-and-expand-with-xai-grok.html,https://nextbigfuture.s3.amazonaws.com/uploads/2024/04/Screen-Shot-2024-04-22-at-9.50.15-AM.jpg,2024-04-22T16:56:08Z,"Future versions of Tesla FSD will likely merge with XAI Grok. While Elon Musk has expressed concerns about building too much of his new AI ideas into Tesla unless he has 25% voting control, the need … [+3030 chars]",tesla,"Future Tesla FSD Will Merge and Expand with XAI Grok Future versions of Tesla FSD will likely merge with XAI Grok. While Elon Musk has expressed concerns about building too much of his new AI ideas into Tesla unless he has 25% voting control, the need to make a competitive AI will force Tesla FSD to work with X…",313.0,"['future', 'fsd', 'merge', 'expand', 'xai', 'grok', 'future', 'versions', 'fsd', 'likely', 'merge', 'xai', 'grok', 'elon', 'musk', 'expressed', 'concerns', 'building', 'much', 'new', 'ai', 'ideas', 'unless', 'voting', 'control', 'need', 'make', 'competitive', 'ai', 'force', 'fsd', 'work', 'x']",33
"{'id': 'next-big-future', 'name': 'Next Big Future'}",Brian Wang,Did Elon Cut Tesla Supercharging as a Power Move?,"There has been a lot of speculation about why Tesla cut the 500 person team for Tesla Supercharging infrastructure. Patrick Bet David, successful entrepreneur, podcaster and youtuber has posted the case that Elon Musk cut the Tesla Supercharging infrastructur…",https://www.nextbigfuture.com/2024/05/did-elon-cut-tesla-supercharging-as-a-power-move.html,https://nextbigfuture.s3.amazonaws.com/uploads/2024/05/Screen-Shot-2024-05-04-at-2.04.11-PM.jpg,2024-05-04T21:13:42Z,"There has been a lot of speculation about why Tesla cut the 500 person team for Tesla Supercharging infrastructure. Patrick Bet David, successful entrepreneur, podcaster and youtuber has posted the c… [+7520 chars]",tesla,"Did Elon Cut Tesla Supercharging as a Power Move? There has been a lot of speculation about why Tesla cut the 500 person team for Tesla Supercharging infrastructure. Patrick Bet David, successful entrepreneur, podcaster and youtuber has posted the case that Elon Musk cut the Tesla Supercharging infrastructur…",310.0,"['elon', 'cut', 'supercharging', 'power', 'move', 'lot', 'speculation', 'cut', 'person', 'team', 'supercharging', 'infrastructure', 'patrick', 'bet', 'david', 'successful', 'entrepreneur', 'podcaster', 'youtuber', 'posted', 'case', 'elon', 'musk', 'cut', 'supercharging', 'infrastructur']",26
"{'id': None, 'name': 'Ozbargain.com.au'}",Bippz01,"Tesla Model 3 Performance $82,700 Delivered + on-Road Costs @ Tesla","These are the website prices for QLD personal use.

The PERFORMANCE version has been relaunched.
All-new high-performance drive units deliver a combined 460 horsepower and 0-100 km/h in 3.1 seconds. Welcome to the most powerful Model 3 ever.

528 km Range (WL…",https://www.ozbargain.com.au/node/842643,https://files.ozbargain.com.au/n/43/842643x.jpg?h=24396263,2024-04-24T05:55:43Z,"These are the website prices for QLD personal use.
The PERFORMANCE version has been relaunched.All-new high-performance drive units deliver a combined 460 horsepower and 0-100 km/h in 3.1 seconds. W… [+204 chars]",tesla,"Tesla Model 3 Performance $82,700 Delivered + on-Road Costs @ Tesla These are the website prices for QLD personal use.

The PERFORMANCE version has been relaunched.
All-new high-performance drive units deliver a combined 460 horsepower and 0-100 km/h in 3.1 seconds. Welcome to the most powerful Model 3 ever.

528 km Range (WL…",328.0,"['model', 'performance', 'delivered', 'on-road', 'costs', 'website', 'prices', 'qld', 'personal', 'use', 'performance', 'version', 'relaunched', 'all-new', 'high-performance', 'drive', 'units', 'deliver', 'combined', 'horsepower', 'km', 'h', 'seconds', 'welcome', 'powerful', 'model', 'ever', 'km', 'range', 'wl']",30
"{'id': None, 'name': 'Techreport.com'}",Krishi Chowdhary,"Tesla Decides to Recall 3,878 Cybertrucks over Concerns about Unintentional Acceleration","Tesla has decided to recall all Cybertrucks it made, 3878 to be precise, fearing they might automatically accelerate. The Friday filing from the US National Highway Traffic Safety Administration (NHTSA)...
The post Tesla Decides to Recall 3,878 Cybertrucks ov…",https://techreport.com/news/tesla-recall-cybertrucks-unintentional-acceleration/,https://techreport.com/wp-content/uploads/2024/04/Tesla-Cybertruck-scaled.jpg?_t=1713696701,2024-04-21T08:11:08Z,<ul><li> Tesla has announced that it will recall all Cybertrucks made between November and April after it received complaints that the cars might unintentionally accelerate</li><li> Affected customer… [+2675 chars],tesla,"Tesla Decides to Recall 3,878 Cybertrucks over Concerns about Unintentional Acceleration Tesla has decided to recall all Cybertrucks it made, 3878 to be precise, fearing they might automatically accelerate. The Friday filing from the US National Highway Traffic Safety Administration (NHTSA)...
The post Tesla Decides to Recall 3,878 Cybertrucks ov…",349.0,"['decides', 'recall', 'cybertrucks', 'concerns', 'unintentional', 'acceleration', 'decided', 'recall', 'cybertrucks', 'made', 'precise', 'fearing', 'might', 'automatically', 'accelerate', 'friday', 'filing', 'us', 'national', 'highway', 'traffic', 'safety', 'administration', 'nhtsa', 'post', 'decides', 'recall', 'cybertrucks', 'ov']",29
"{'id': None, 'name': 'The Indian Express'}","Sonal Gupta, Ayesha Jain",Daily Briefing: Delhi Congress chief resigns; troubles for MDH; Virat Kohli hits out at critics; and more,In today’s edition: A Lok Sabha election wrap; troubles for MDH; Elon Musk’s China visit; Virat Kohli hits out at critics; and more,https://indianexpress.com/article/live-news/daily-briefing-top-news-today-9296264/,https://images.indianexpress.com/2024/04/cover_a5b45e.jpg,2024-04-29T03:34:48Z,"In mounting trouble for Congress, its Delhi chief Arvinder Singh Lovely resigned from the party, citing its alliance with the Aam Aadmi Party (AAP). Lovely’s decision signals at more exits from the C… [+3670 chars]",tesla,Daily Briefing: Delhi Congress chief resigns; troubles for MDH; Virat Kohli hits out at critics; and more In today’s edition: A Lok Sabha election wrap; troubles for MDH; Elon Musk’s China visit; Virat Kohli hits out at critics; and more,237.0,"['daily', 'briefing', 'delhi', 'congress', 'chief', 'resigns', 'troubles', 'mdh', 'virat', 'kohli', 'hits', 'critics', 'today', 'edition', 'lok', 'sabha', 'election', 'wrap', 'troubles', 'mdh', 'elon', 'musk', 'china', 'visit', 'virat', 'kohli', 'hits', 'critics']",28
"{'id': 'next-big-future', 'name': 'Next Big Future'}",Brian Wang,Panel Discussion on Tesla Getting China Approvals and Baidu FSD Map Deal,"I was on a youtube panel discussion with Herbert Ong, Jeff Lutz and Xander Sky. We were talking yesterday about the major Tesla deal with Baidu for FSD mapping and for the various China approvals that put Tesla on the brink of being fully authorized to sell F…",https://www.nextbigfuture.com/2024/04/panel-discussion-on-tesla-getting-china-approvals-and-baidu-fsd-map-deal.html,https://nextbigfuture.s3.amazonaws.com/uploads/2024/04/Screen-Shot-2024-04-30-at-2.50.55-PM-1024x441.jpg,2024-04-30T21:53:10Z,"I was on a youtube panel discussion with Herbert Ong, Jeff Lutz and Xander. We were talking yesterday about the major Tesla deal with Baidu for FSD mapping and for the various China approvals that pu… [+2569 chars]",tesla,"Panel Discussion on Tesla Getting China Approvals and Baidu FSD Map Deal I was on a youtube panel discussion with Herbert Ong, Jeff Lutz and Xander Sky. We were talking yesterday about the major Tesla deal with Baidu for FSD mapping and for the various China approvals that put Tesla on the brink of being fully authorized to sell F…",333.0,"['panel', 'discussion', 'getting', 'china', 'approvals', 'baidu', 'fsd', 'map', 'deal', 'youtube', 'panel', 'discussion', 'herbert', 'ong', 'jeff', 'lutz', 'xander', 'sky', 'talking', 'yesterday', 'major', 'deal', 'baidu', 'fsd', 'mapping', 'various', 'china', 'approvals', 'put', 'brink', 'fully', 'authorized', 'sell', 'f']",34
"{'id': None, 'name': 'Speedhunters.com'}",Dino Dalle Carbonare,Fitted In Fuji: The 2024 RAYS Fan Meeting,"RAYS put on this meet to thank its loyal customer base, and this year, over 750 attendee cars turned out at Fuji Speedway to be a part of the event. Anyone with RAYS wheels on their vehicle got a parking spot and free entry. For me, what makes the RAYS Fan Me…",https://www.speedhunters.com/2024/05/2024-rays-fan-meeting/,https://s3.amazonaws.com/speedhunters-wp-production/wp-content/uploads/2024/04/30185246/rays_fan_meeting_24_dino_dalle_carbonare_168.jpg,2024-05-02T05:30:53Z,"SHARE
 Fitted In Fuji: The 2024 RAYS Fan Meeting 
It might only be three years old, but the RAYS Fan Meeting is quickly becoming a must-attend event in Japan especially if your car is rolling on wh… [+5172 chars]",toyota,"Fitted In Fuji: The 2024 RAYS Fan Meeting RAYS put on this meet to thank its loyal customer base, and this year, over 750 attendee cars turned out at Fuji Speedway to be a part of the event. Anyone with RAYS wheels on their vehicle got a parking spot and free entry. For me, what makes the RAYS Fan Me…",302.0,"['fitted', 'fuji', 'rays', 'fan', 'meeting', 'rays', 'put', 'meet', 'thank', 'loyal', 'customer', 'base', 'year', 'attendee', 'cars', 'turned', 'fuji', 'speedway', 'part', 'event', 'anyone', 'rays', 'wheels', 'vehicle', 'got', 'parking', 'spot', 'free', 'entry', 'makes', 'rays', 'fan']",32
"{'id': None, 'name': 'Raleigh News & Observer'}",Richard Stradling,The Triangle region has another interstate highway in its future,NCDOT unveils signs for “Future I-685” along U.S. 421. What does that mean and where will it go?,https://www.newsobserver.com/news/local/article288583988.html,https://media.zenfs.com/en/raleigh_news_and_observer_mcclatchy_712/be25d488838283ac58e2bcb8521307f7,2024-05-20T17:02:29Z,"Interstate highways continue to multiply in North Carolina.
State and local officials on Monday unveiled signs for Future I-685, which will someday follow U.S. 421 from I-85 near Greensboro southeas… [+3194 chars]",toyota,The Triangle region has another interstate highway in its future NCDOT unveils signs for “Future I-685” along U.S. 421. What does that mean and where will it go?,161.0,"['triangle', 'region', 'another', 'interstate', 'highway', 'future', 'ncdot', 'unveils', 'signs', 'future', 'i-685', 'along', 'u', 'mean', 'go']",15
"{'id': None, 'name': 'Yahoo Entertainment'}",Danny Lee,BYD Unveils Hybrid Powertrain Capable of Ultra-Long Drive,"(Bloomberg) -- BYD Co. unveiled a new hybrid powertrain capable of traveling more than 2,000 kilometers (1,250 miles) without recharging or refueling...",https://finance.yahoo.com/news/byd-shows-off-hybrid-powertrain-125608793.html,https://s.yimg.com/ny/api/res/1.2/vkH6y_6D2ojMvmQ8lJ89OA--/YXBwaWQ9aGlnaGxhbmRlcjt3PTEyMDA7aD04MDA-/https://media.zenfs.com/en/bloomberg_technology_68/971f85840e59ce83fffeac23608055d1,2024-05-29T01:13:02Z,"(Bloomberg) -- BYD Co. unveiled a new hybrid powertrain capable of traveling more than 2,000 kilometers (1,250 miles) without recharging or refueling, intensifying the EV transition war against Toyot… [+2617 chars]",toyota,"BYD Unveils Hybrid Powertrain Capable of Ultra-Long Drive (Bloomberg) -- BYD Co. unveiled a new hybrid powertrain capable of traveling more than 2,000 kilometers (1,250 miles) without recharging or refueling...",210.0,"['byd', 'unveils', 'hybrid', 'powertrain', 'capable', 'ultra-long', 'drive', 'bloomberg', 'byd', 'co', 'unveiled', 'new', 'hybrid', 'powertrain', 'capable', 'traveling', 'kilometers', 'miles', 'without', 'recharging', 'refueling']",21
"{'id': None, 'name': 'Digitimes'}",DIGITIMES,"New BYD hybrid can drive non-stop for more than 2,000 kilometers","BYD Co. unveiled a new hybrid powertrain capable of traveling more than 2,000 kilometers (1,250 miles) without recharging or refueling, intensifying the EV transition war against Toyota Motor Corp. and Volkswagen AG.",https://www.digitimes.com/news/a20240529VL203.html,https://img.digitimes.com/newsshow/20240529vl203_files/2_2b.jpg,2024-05-29T08:37:14Z,"Save my User ID and Password
Some subscribers prefer to save their log-in information so they do not have to enter their User ID and Password each time they visit the site. To activate this function… [+307 chars]",toyota,"New BYD hybrid can drive non-stop for more than 2,000 kilometers BYD Co. unveiled a new hybrid powertrain capable of traveling more than 2,000 kilometers (1,250 miles) without recharging or refueling, intensifying the EV transition war against Toyota Motor Corp. and Volkswagen AG.",281.0,"['new', 'byd', 'hybrid', 'drive', 'non-stop', 'kilometers', 'byd', 'co', 'unveiled', 'new', 'hybrid', 'powertrain', 'capable', 'traveling', 'kilometers', 'miles', 'without', 'recharging', 'refueling', 'intensifying', 'ev', 'transition', 'war', 'motor', 'corp', 'volkswagen', 'ag']",27
"{'id': None, 'name': 'Bangkok Post'}",,Kunlavut and Ratchanok spearhead stellar line-up,"Kunlavut Vitidsarn and Ratchanok Intanon headline a star-studded field at the US$420,000 (approx 17.4 million baht) BWF Toyota Thailand 2024, starting today (Tuesday) at Nimibutr Stadium.",https://www.bangkokpost.com/sports/2792459/kunlavut-and-ratchanok-spearhead-stellar-line-up,https://static.bangkokpost.com/media/content/dcx/2024/05/14/5143634_700.jpg,2024-05-13T22:14:00Z,"Kunlavut Vitidsarn and Ratchanok Intanon headline a star-studded field at the US$420,000 (approx 17.4 million baht) BWF Toyota Thailand 2024, starting today (Tuesday) at Nimibutr Stadium.
World No.8… [+1539 chars]",toyota,"Kunlavut and Ratchanok spearhead stellar line-up Kunlavut Vitidsarn and Ratchanok Intanon headline a star-studded field at the US$420,000 (approx 17.4 million baht) BWF Toyota Thailand 2024, starting today (Tuesday) at Nimibutr Stadium.",236.0,"['kunlavut', 'ratchanok', 'spearhead', 'stellar', 'line-up', 'kunlavut', 'vitidsarn', 'ratchanok', 'intanon', 'headline', 'star-studded', 'field', 'us', 'approx', 'million', 'baht', 'bwf', 'thailand', 'starting', 'today', 'tuesday', 'nimibutr', 'stadium']",23
"{'id': None, 'name': 'Bangkok Post'}",,Thai mixed duos make progress,Mixed doubles stars Dechapol Puavaranukroh and Sapsiree Taerattanachai cruised into the second round of the BWF Toyota Thailand Open at Nimibutr Stadium on Tuesday.,https://www.bangkokpost.com/sports/2792895/thai-mixed-duos-make-progress,https://static.bangkokpost.com/media/content/dcx/2024/05/15/5144565_700.jpg,2024-05-14T21:34:00Z,"Mixed doubles stars Dechapol Puavaranukroh and Sapsiree Taerattanachai cruised into the second round of the BWF Toyota Thailand Open at Nimibutr Stadium on Tuesday.
The top-seeded Thai pair stormed … [+1901 chars]",toyota,Thai mixed duos make progress Mixed doubles stars Dechapol Puavaranukroh and Sapsiree Taerattanachai cruised into the second round of the BWF Toyota Thailand Open at Nimibutr Stadium on Tuesday.,194.0,"['thai', 'mixed', 'duos', 'make', 'progress', 'mixed', 'doubles', 'stars', 'dechapol', 'puavaranukroh', 'sapsiree', 'taerattanachai', 'cruised', 'second', 'round', 'bwf', 'thailand', 'open', 'nimibutr', 'stadium', 'tuesday']",21
"{'id': None, 'name': 'PEOPLE'}",David Chiu,Georgia Boy Released from Hospital After Car Crash Kills His 2 Brothers and Parents: 'God Blessed Us',"“He still has a ways to go. But the outlook is great,"" Noah Mason's grandmother said",https://people.com/georgia-boy-released-from-hospital-after-car-crash-kills-his-2-brothers-parents-8654219,https://s.yimg.com/ny/api/res/1.2/7DAWetuvQRwLdFqRpPgvxA--/YXBwaWQ9aGlnaGxhbmRlcjt3PTEyMDA7aD04MDA-/https://media.zenfs.com/en/people_218/8150c21a3ec07d0dbf99756201030916,2024-05-27T15:18:11Z,"He still has a ways to go. But the outlook is great,"" Noah Mason's grandmother said
GoFundMe
 Four of the five members of the Mason family were killed in a May 19 multi-vehicle car crash, authoriti… [+3118 chars]",toyota,"Georgia Boy Released from Hospital After Car Crash Kills His 2 Brothers and Parents: 'God Blessed Us' “He still has a ways to go. But the outlook is great,"" Noah Mason's grandmother said",186.0,"['georgia', 'boy', 'released', 'hospital', 'car', 'crash', 'kills', 'brothers', 'parents', 'god', 'blessed', 'us', 'still', 'ways', 'go', 'outlook', 'great', 'noah', 'mason', 'grandmother', 'said']",21
"{'id': None, 'name': 'Daily Beast'}",AJ McDougall,‘9-1-1’ Crew Member Dies in Car Accident After 14-Hour Overnight Shift,"Fox via Getty Images
A crew member on 9-1-1 died early Saturday in a car accident along the California highway after working a 14-hour overnight shift.Rico Priem, a 66-year-old grip, was identified as the crash victim, according to Variety, citing the Los An…",https://www.thedailybeast.com/9-1-1-crew-member-dies-in-car-accident-after-14-hour-overnight-shift,"https://img.thedailybeast.com/image/upload/c_crop,d_placeholder_euli9k,h_2025,w_3600,x_0,y_31/dpr_2.0/c_limit,w_740/fl_lossy,q_auto/v1715642446/GettyImages-1242303957_uygjyb",2024-05-13T23:48:03Z,"A crew member on 9-1-1 died early Saturday in a car accident along the California highway after working a 14-hour overnight shift.
Rico Priem, a 66-year-old grip, was identified as the crash victim,… [+2610 chars]",toyota,"‘9-1-1’ Crew Member Dies in Car Accident After 14-Hour Overnight Shift Fox via Getty Images
A crew member on 9-1-1 died early Saturday in a car accident along the California highway after working a 14-hour overnight shift.Rico Priem, a 66-year-old grip, was identified as the crash victim, according to Variety, citing the Los An…",331.0,"['crew', 'member', 'dies', 'car', 'accident', '14-hour', 'overnight', 'shift', 'fox', 'via', 'getty', 'images', 'crew', 'member', 'died', 'early', 'saturday', 'car', 'accident', 'along', 'california', 'highway', 'working', '14-hour', 'overnight', 'shift', 'rico', 'priem', '66-year-old', 'grip', 'identified', 'crash', 'victim', 'according', 'variety', 'citing', 'los']",37
"{'id': None, 'name': 'CleanTechnica'}",David Waterworth,Peppermint Pattie Conversion — Powered by OZDIY,Converting a classic petrol-powered car to electric is a time consuming and expensive business. CleanTechnica has published many articles about the practice. Here’s a recent one about a Mazda Bongo van conversion. Some begin the process and never finish. Pepp…,https://cleantechnica.com/2024/05/09/peppermint-pattie-conversion-powered-by-ozdiy/,https://cleantechnica.com/wp-content/uploads/2024/05/EV-conversion-Tesla-Model-3-Australia-800x445.png,2024-05-09T12:34:52Z,"Sign up for daily news updates from CleanTechnica on email. Or follow us on Google News!
Converting a classic petrol-powered car to electric is a time consuming and expensive business. CleanTechnica… [+5296 chars]",toyota,Peppermint Pattie Conversion — Powered by OZDIY Converting a classic petrol-powered car to electric is a time consuming and expensive business. CleanTechnica has published many articles about the practice. Here’s a recent one about a Mazda Bongo van conversion. Some begin the process and never finish. Pepp…,308.0,"['peppermint', 'pattie', 'conversion', 'powered', 'ozdiy', 'converting', 'classic', 'petrol-powered', 'car', 'electric', 'time', 'consuming', 'expensive', 'business', 'cleantechnica', 'published', 'many', 'articles', 'practice', 'recent', 'one', 'mazda', 'bongo', 'van', 'conversion', 'begin', 'process', 'never', 'finish', 'pepp']",30
"{'id': None, 'name': 'Digitimes'}",DIGITIMES,"Backed by robust profit, Toyota to invest JPY2 trillion in supply chain, EV, SDV","Toyota Motor reported hefty profit growth for the past fiscal year ending March 2024, thanks to booming hybrid EV sales and a weaker Japanese Yen. The automaker said it plans to invest JPY2 trillion (US$13.79 billion) in its suppliers, growing the EV lineup a…",https://www.digitimes.com/news/a20240509VL203/toyota-ev-sdv-supply-chain.html,https://img.digitimes.com/newsshow/20240509vl203_files/1_2b.jpg,2024-05-09T03:48:55Z,"Save my User ID and Password
Some subscribers prefer to save their log-in information so they do not have to enter their User ID and Password each time they visit the site. To activate this function… [+307 chars]",toyota,"Backed by robust profit, Toyota to invest JPY2 trillion in supply chain, EV, SDV Toyota Motor reported hefty profit growth for the past fiscal year ending March 2024, thanks to booming hybrid EV sales and a weaker Japanese Yen. The automaker said it plans to invest JPY2 trillion (US$13.79 billion) in its suppliers, growing the EV lineup a…",341.0,"['backed', 'robust', 'profit', 'invest', 'jpy2', 'trillion', 'supply', 'chain', 'ev', 'sdv', 'motor', 'reported', 'hefty', 'profit', 'growth', 'past', 'fiscal', 'year', 'ending', 'march', 'thanks', 'booming', 'hybrid', 'ev', 'sales', 'weaker', 'japanese', 'yen', 'automaker', 'said', 'plans', 'invest', 'jpy2', 'trillion', 'us', 'billion', 'suppliers', 'growing', 'ev', 'lineup']",40
"{'id': None, 'name': 'Minneapolis Star Tribune'}",NICK KURCZEWSKI,Edmunds: 2024 Kia Niro versus 2024 Toyota Corolla Cross,"Many car shoppers simply want a vehicle that's practical, easy to drive and relatively inexpensive. High fuel economy is increasingly a popular desire as well. If this sounds like what you're looking for in your next vehicle, consider the 2024 Kia Niro or the…",https://www.startribune.com/edmunds-2024-kia-niro-versus-2024-toyota-corolla-cross/600362960/,https://www.startribune.com/static/img/branding/logos/strib-social-card.png?d=1713369823,2024-05-01T10:15:48Z,"Many car shoppers simply want a vehicle that's practical, easy to drive and relatively inexpensive. High fuel economy is increasingly a popular desire as well. If this sounds like what you're looking… [+4102 chars]",toyota,"Edmunds: 2024 Kia Niro versus 2024 Toyota Corolla Cross Many car shoppers simply want a vehicle that's practical, easy to drive and relatively inexpensive. High fuel economy is increasingly a popular desire as well. If this sounds like what you're looking for in your next vehicle, consider the 2024 Kia Niro or the…",316.0,"['edmunds', 'kia', 'niro', 'versus', 'corolla', 'cross', 'many', 'car', 'shoppers', 'simply', 'want', 'vehicle', 'practical', 'easy', 'drive', 'relatively', 'inexpensive', 'high', 'fuel', 'economy', 'increasingly', 'popular', 'desire', 'well', 'sounds', 'like', 'looking', 'next', 'vehicle', 'consider', 'kia', 'niro']",32
