source,author,title,description,url,urlToImage,publishedAt,content,label,text,length,tokens,num_tokens
"{'id': None, 'name': 'Biztoc.com'}",zerohedge.com,"Key Events This Week: PCE, GDP, Fed Blackout And Earnings Gallore","Key Events This Week: PCE, GDP, Fed Blackout And Earnings Gallore Hot on the heels of last week's tech and momentum rout, shaken traders will have to wait until Friday for the main macro event namely the US core PCE print within the income and spending report…",https://biztoc.com/x/a7f2805aa040cff6,https://c.biztoc.com/p/a7f2805aa040cff6/s.webp,2024-04-22T14:08:05Z,"Key Events This Week: PCE, GDP, Fed Blackout And Earnings Gallore 
Hot on the heels of last week's tech and momentum rout, shaken traders will have to wait until Friday for the main macro event name… [+279 chars]",tesla,"Key Events This Week: PCE, GDP, Fed Blackout And Earnings Gallore Key Events This Week: PCE, GDP, Fed Blackout And Earnings Gallore Hot on the heels of last week's tech and momentum rout, shaken traders will have to wait until Friday for the main macro event namely the US core PCE print within the income and spending report…",326.0,"['key', 'events', 'week', 'pce', 'gdp', 'fed', 'blackout', 'earnings', 'gallore', 'key', 'events', 'week', 'pce', 'gdp', 'fed', 'blackout', 'earnings', 'gallore', 'hot', 'heels', 'last', 'week', 'tech', 'momentum', 'rout', 'shaken', 'traders', 'wait', 'friday', 'main', 'macro', 'event', 'namely', 'us', 'core', 'pce', 'print', 'within', 'income', 'spending', 'report']",41
"{'id': None, 'name': 'Biztoc.com'}",cryptonews.com,Dogecoin Price Prediction as $700 Million Trading Volume Sends DOGE into the Green,"Dogecoin Price Prediction In the latest Dogecoin price prediction, a notable 24-hour trading volume of $700 million has propelled DOGE to a 2.75% increase, trading at $0.150180. As this meme-inspired cryptocurrency retains its 8th place on CoinMarketCap with …",https://biztoc.com/x/7e8c4cdb73d1af99,https://c.biztoc.com/p/7e8c4cdb73d1af99/s.webp,2024-04-28T16:10:06Z,"Dogecoin Price PredictionIn the latest Dogecoin price prediction, a notable 24-hour trading volume of $700 million has propelled DOGE to a 2.75% increase, trading at $0.150180. As this meme-inspired … [+298 chars]",tesla,"Dogecoin Price Prediction as $700 Million Trading Volume Sends DOGE into the Green Dogecoin Price Prediction In the latest Dogecoin price prediction, a notable 24-hour trading volume of $700 million has propelled DOGE to a 2.75% increase, trading at $0.150180. As this meme-inspired cryptocurrency retains its 8th place on CoinMarketCap with …",343.0,"['dogecoin', 'price', 'prediction', 'million', 'trading', 'volume', 'sends', 'doge', 'green', 'dogecoin', 'price', 'prediction', 'latest', 'dogecoin', 'price', 'prediction', 'notable', '24-hour', 'trading', 'volume', 'million', 'propelled', 'doge', 'increase', 'trading', 'meme-inspired', 'cryptocurrency', 'retains', '8th', 'place', 'coinmarketcap']",31
"{'id': None, 'name': 'Biztoc.com'}",aol.com,Hertz is done gambling with EVs: It took a first-quarter $195 million hit on Teslas that just keep losing value and can’t sell them fast enough,"Hertz is hurting. The company was expecting a challenging first quarter, but it got more than it bargained for: It reported a $392 million adjusted net loss on Thursday. Despite increases in rental car demand, Hertz said it’s been bruised by its fleet of elec…",https://biztoc.com/x/fce7a589d14b3007,https://c.biztoc.com/p/fce7a589d14b3007/s.webp,2024-04-26T00:22:06Z,"Hertz is hurting. The company was expecting a challenging first quarter, but it got more than it bargained for: It reported a $392 million adjusted net loss on Thursday. Despite increases in rental c… [+286 chars]",tesla,"Hertz is done gambling with EVs: It took a first-quarter $195 million hit on Teslas that just keep losing value and can’t sell them fast enough Hertz is hurting. The company was expecting a challenging first quarter, but it got more than it bargained for: It reported a $392 million adjusted net loss on Thursday. Despite increases in rental car demand, Hertz said it’s been bruised by its fleet of elec…",404.0,"['hertz', 'done', 'gambling', 'evs', 'took', 'first-quarter', 'million', 'hit', 'teslas', 'keep', 'losing', 'value', 'sell', 'fast', 'enough', 'hertz', 'hurting', 'company', 'expecting', 'challenging', 'first', 'quarter', 'got', 'bargained', 'reported', 'million', 'adjusted', 'net', 'loss', 'thursday', 'despite', 'increases', 'rental', 'car', 'demand', 'hertz', 'said', 'bruised', 'fleet', 'elec']",40
"{'id': None, 'name': 'Biztoc.com'}",finance.yahoo.com,Hertz is done gambling with EVs: It took a first-quarter $195 million hit on Teslas that just keep losing value and can’t sell them fast enough,"Hertz is hurting. The company was expecting a challenging first quarter, but it got more than it bargained for: It reported a $392 million adjusted net loss on Thursday. Despite increases in rental car demand, Hertz said it’s been bruised by its fleet of elec…",https://biztoc.com/x/4c28cd21481a99c0,https://c.biztoc.com/p/4c28cd21481a99c0/s.webp,2024-04-26T16:56:04Z,"Hertz is hurting. The company was expecting a challenging first quarter, but it got more than it bargained for: It reported a $392 million adjusted net loss on Thursday. Despite increases in rental c… [+298 chars]",tesla,"Hertz is done gambling with EVs: It took a first-quarter $195 million hit on Teslas that just keep losing value and can’t sell them fast enough Hertz is hurting. The company was expecting a challenging first quarter, but it got more than it bargained for: It reported a $392 million adjusted net loss on Thursday. Despite increases in rental car demand, Hertz said it’s been bruised by its fleet of elec…",404.0,"['hertz', 'done', 'gambling', 'evs', 'took', 'first-quarter', 'million', 'hit', 'teslas', 'keep', 'losing', 'value', 'sell', 'fast', 'enough', 'hertz', 'hurting', 'company', 'expecting', 'challenging', 'first', 'quarter', 'got', 'bargained', 'reported', 'million', 'adjusted', 'net', 'loss', 'thursday', 'despite', 'increases', 'rental', 'car', 'demand', 'hertz', 'said', 'bruised', 'fleet', 'elec']",40
"{'id': None, 'name': 'Biztoc.com'}",finbold.com,Dogecoin could be on the road to a “long-term bullish rally”,"Meme cryptocurrency Dogecoin (DOGE) continues to dominate the spotlight amid the ongoing market recovery, posting significant gains as it strives to breach the $0.20 resistance. In this regard, a crypto analyst using the pseudonym Behdark in a TradingView pos…",https://biztoc.com/x/410520a832385d35,https://c.biztoc.com/p/410520a832385d35/s.webp,2024-05-05T13:00:14Z,"Meme cryptocurrency Dogecoin (DOGE) continues to dominate the spotlight amid the ongoing market recovery, posting significant gains as it strives to breach the $0.20 resistance.In this regard, a cryp… [+244 chars]",tesla,"Dogecoin could be on the road to a “long-term bullish rally” Meme cryptocurrency Dogecoin (DOGE) continues to dominate the spotlight amid the ongoing market recovery, posting significant gains as it strives to breach the $0.20 resistance. In this regard, a crypto analyst using the pseudonym Behdark in a TradingView pos…",321.0,"['dogecoin', 'could', 'road', 'long-term', 'bullish', 'rally', 'meme', 'cryptocurrency', 'dogecoin', 'doge', 'continues', 'dominate', 'spotlight', 'amid', 'ongoing', 'market', 'recovery', 'posting', 'significant', 'gains', 'strives', 'breach', 'resistance', 'regard', 'crypto', 'analyst', 'using', 'pseudonym', 'behdark', 'tradingview', 'pos']",31
"{'id': None, 'name': 'Biztoc.com'}",investorplace.com,Stock Market Crash Warning: Don’t Get Caught Holding These 3 EV Charging Stocks,"EV charging stocks, despite a boon in infrastructure spending, will suffer from sectoral headwinds. The electric vehicle (EV) market continues to suffer from key demand risks. Interest rates in the United States and abroad remain elevated and will likely rema…",https://biztoc.com/x/e4cef5762c56d542,https://c.biztoc.com/p/e4cef5762c56d542/s.webp,2024-05-05T11:04:08Z,"EV charging stocks, despite a boon in infrastructure spending, will suffer from sectoral headwinds.The electric vehicle (EV) market continues to suffer from key demand risks. Interest rates in the Un… [+283 chars]",tesla,"Stock Market Crash Warning: Don’t Get Caught Holding These 3 EV Charging Stocks EV charging stocks, despite a boon in infrastructure spending, will suffer from sectoral headwinds. The electric vehicle (EV) market continues to suffer from key demand risks. Interest rates in the United States and abroad remain elevated and will likely rema…",340.0,"['stock', 'market', 'crash', 'warning', 'get', 'caught', 'holding', 'ev', 'charging', 'stocks', 'ev', 'charging', 'stocks', 'despite', 'boon', 'infrastructure', 'spending', 'suffer', 'sectoral', 'headwinds', 'electric', 'vehicle', 'ev', 'market', 'continues', 'suffer', 'key', 'demand', 'risks', 'interest', 'rates', 'united', 'states', 'abroad', 'remain', 'elevated', 'likely', 'rema']",38
"{'id': None, 'name': 'Biztoc.com'}",investorplace.com,3 EV Stocks That Could Be Multibaggers in the Making: April Edition,"Energize your portfolio with these EV picks Investing in electric vehicle (EV) stocks has become a standout trend of the decade. However, it comes with inherent volatility. As of 2024, global EV demand shows signs of weakening. Despite this, the future of the…",https://biztoc.com/x/665d05a59d41179f,https://c.biztoc.com/p/665d05a59d41179f/s.webp,2024-04-23T11:48:05Z,"Energize your portfolio with these EV picksInvesting in electric vehicle (EV) stocks has become a standout trend of the decade. However, it comes with inherent volatility.As of 2024, global EV demand… [+293 chars]",tesla,"3 EV Stocks That Could Be Multibaggers in the Making: April Edition Energize your portfolio with these EV picks Investing in electric vehicle (EV) stocks has become a standout trend of the decade. However, it comes with inherent volatility. As of 2024, global EV demand shows signs of weakening. Despite this, the future of the…",328.0,"['ev', 'stocks', 'could', 'multibaggers', 'making', 'april', 'edition', 'energize', 'portfolio', 'ev', 'picks', 'investing', 'electric', 'vehicle', 'ev', 'stocks', 'become', 'standout', 'trend', 'decade', 'however', 'comes', 'inherent', 'volatility', 'global', 'ev', 'demand', 'shows', 'signs', 'weakening', 'despite', 'future']",32
"{'id': None, 'name': 'Biztoc.com'}",investorplace.com,Stock Moving Today?,AFRM stock is falling on WMT's addition of One Affirm (NASDAQ:AFRM) stock is falling on Tuesday after Walmart’s (NYSE:WMT) One launched its buy now pay later (BNPL) service at the retail giant’s stores. With this comes the addition of One of the company’s kio…,https://biztoc.com/x/262167c5623c3bde,https://c.biztoc.com/p/262167c5623c3bde/s.webp,2024-04-23T14:22:08Z,AFRM stock is falling on WMT's addition of OneAffirm (NASDAQ:AFRM) stock is falling on Tuesday after Walmarts (NYSE:WMT) One launched its buy now pay later (BNPL) service at the retail giants stores.… [+280 chars],tesla,Stock Moving Today? AFRM stock is falling on WMT's addition of One Affirm (NASDAQ:AFRM) stock is falling on Tuesday after Walmart’s (NYSE:WMT) One launched its buy now pay later (BNPL) service at the retail giant’s stores. With this comes the addition of One of the company’s kio…,280.0,"['stock', 'moving', 'today', 'afrm', 'stock', 'falling', 'wmt', 'addition', 'one', 'affirm', 'nasdaq', 'afrm', 'stock', 'falling', 'tuesday', 'walmart', 'nyse', 'wmt', 'one', 'launched', 'buy', 'pay', 'later', 'bnpl', 'service', 'retail', 'giant', 'stores', 'comes', 'addition', 'one', 'company', 'kio']",33
"{'id': None, 'name': 'Biztoc.com'}",bostonherald.com,Tesla’s first-quarter net income tumbles 55% as falling global sales and price cuts reduce profits,"Tesla’s first-quarter net income plummeted 55% as falling global sales and price cuts sliced into the electric vehicle maker’s revenue and profit margins. The Austin, Texas, company said it made $1.13 billion from January through March compared with $2.51 bil…",https://biztoc.com/x/136bb0ce9f87e99a,https://c.biztoc.com/p/136bb0ce9f87e99a/s.webp,2024-04-23T21:04:08Z,"Teslas first-quarter net income plummeted 55% as falling global sales and price cuts sliced into the electric vehicle makers revenue and profit margins.The Austin, Texas, company said it made $1.13 b… [+289 chars]",tesla,"Tesla’s first-quarter net income tumbles 55% as falling global sales and price cuts reduce profits Tesla’s first-quarter net income plummeted 55% as falling global sales and price cuts sliced into the electric vehicle maker’s revenue and profit margins. The Austin, Texas, company said it made $1.13 billion from January through March compared with $2.51 bil…",359.0,"['first-quarter', 'net', 'income', 'tumbles', 'falling', 'global', 'sales', 'price', 'cuts', 'reduce', 'profits', 'first-quarter', 'net', 'income', 'plummeted', 'falling', 'global', 'sales', 'price', 'cuts', 'sliced', 'electric', 'vehicle', 'maker', 'revenue', 'profit', 'margins', 'austin', 'texas', 'company', 'said', 'made', 'billion', 'january', 'march', 'compared', 'bil']",37
"{'id': None, 'name': 'Biztoc.com'}",investorplace.com,3 EV Stocks to Buy ASAP Before Demand Ramps Right Back Up,"These stocks are screaming buys before an EV comeback Since the beginning of 2024, concern for the electric vehicle (EV) market has risen while many EV stocks have trended downward. After enjoying a red-hot surge of enthusiasm, the sector has definitely coole…",https://biztoc.com/x/df25bb6eb354d0cc,https://c.biztoc.com/p/df25bb6eb354d0cc/s.webp,2024-04-24T22:22:08Z,"These stocks are screaming buys before an EV comebackSince the beginning of 2024, concern for the electric vehicle (EV) market has risen while many EV stocks have trended downward. After enjoying a r… [+284 chars]",tesla,"3 EV Stocks to Buy ASAP Before Demand Ramps Right Back Up These stocks are screaming buys before an EV comeback Since the beginning of 2024, concern for the electric vehicle (EV) market has risen while many EV stocks have trended downward. After enjoying a red-hot surge of enthusiasm, the sector has definitely coole…",318.0,"['ev', 'stocks', 'buy', 'asap', 'demand', 'ramps', 'right', 'back', 'stocks', 'screaming', 'buys', 'ev', 'comeback', 'since', 'beginning', 'concern', 'electric', 'vehicle', 'ev', 'market', 'risen', 'many', 'ev', 'stocks', 'trended', 'downward', 'enjoying', 'red-hot', 'surge', 'enthusiasm', 'sector', 'definitely', 'coole']",33
"{'id': None, 'name': 'Biztoc.com'}",aol.com,Doubts about Tesla's performance reach fever pitch as electric vehicle giant reports earnings,But the Elon Musk-helmed electric vehicle giant is now facing some of the biggest questions in its history amid weakening sales and questions about Musk's focus. A growing share of investors want to know where the company is heading now that demand for all-el…,https://biztoc.com/x/d5b422eb91fd5947,https://c.biztoc.com/p/d5b422eb91fd5947/s.webp,2024-04-23T20:52:05Z,But the Elon Musk-helmed electric vehicle giant is now facing some of the biggest questions in its history amid weakening sales and questions about Musk's focus.A growing share of investors want to k… [+266 chars],tesla,Doubts about Tesla's performance reach fever pitch as electric vehicle giant reports earnings But the Elon Musk-helmed electric vehicle giant is now facing some of the biggest questions in its history amid weakening sales and questions about Musk's focus. A growing share of investors want to know where the company is heading now that demand for all-el…,354.0,"['doubts', 'performance', 'reach', 'fever', 'pitch', 'electric', 'vehicle', 'giant', 'reports', 'earnings', 'elon', 'musk-helmed', 'electric', 'vehicle', 'giant', 'facing', 'biggest', 'questions', 'history', 'amid', 'weakening', 'sales', 'questions', 'musk', 'focus', 'growing', 'share', 'investors', 'want', 'know', 'company', 'heading', 'demand', 'all-el']",34
"{'id': None, 'name': 'Biztoc.com'}",fortune.com,Elon Musk’s shock firing of Supercharger team sparks broader fears about the future of the EV industry,"Elon Musk is on the warpath. Now the electric vehicle industry is no longer growing exponentially, he’s pivoting towards robotics having sacked more than a tenth of his workforce, shelved plans to build a low-cost car and fired his head of fast charging. Whil…",https://biztoc.com/x/df7ca7cc72b70464,https://c.biztoc.com/p/df7ca7cc72b70464/s.webp,2024-05-02T14:08:05Z,"Elon Musk is on the warpath. Now the electric vehicle industry is no longer growing exponentially, hes pivoting towards robotics having sacked more than a tenth of his workforce, shelved plans to bui… [+290 chars]",tesla,"Elon Musk’s shock firing of Supercharger team sparks broader fears about the future of the EV industry Elon Musk is on the warpath. Now the electric vehicle industry is no longer growing exponentially, he’s pivoting towards robotics having sacked more than a tenth of his workforce, shelved plans to build a low-cost car and fired his head of fast charging. Whil…",363.0,"['elon', 'musk', 'shock', 'firing', 'supercharger', 'team', 'sparks', 'broader', 'fears', 'future', 'ev', 'industry', 'elon', 'musk', 'warpath', 'electric', 'vehicle', 'industry', 'longer', 'growing', 'exponentially', 'pivoting', 'towards', 'robotics', 'sacked', 'tenth', 'workforce', 'shelved', 'plans', 'build', 'low-cost', 'car', 'fired', 'head', 'fast', 'charging', 'whil']",37
"{'id': None, 'name': 'Biztoc.com'}",abcnews.go.com,Volkswagen revamps its approach in China in bid to overtake upstart EV makers,"Foreign automakers have been caught flat-footed in China by an electric vehicle boom that has shaken up the market over the last three years BEIJING -- As auto giant Volkswagen AG races to catch up with upstart Chinese competitors, it has drivers like 26-year…",https://biztoc.com/x/f961119170a55d05,https://c.biztoc.com/p/f961119170a55d05/s.webp,2024-04-28T14:48:05Z,Foreign automakers have been caught flat-footed in China by an electric vehicle boom that has shaken up the market over the last three yearsBEIJING -- As auto giant Volkswagen AG races to catch up wi… [+310 chars],tesla,"Volkswagen revamps its approach in China in bid to overtake upstart EV makers Foreign automakers have been caught flat-footed in China by an electric vehicle boom that has shaken up the market over the last three years BEIJING -- As auto giant Volkswagen AG races to catch up with upstart Chinese competitors, it has drivers like 26-year…",338.0,"['volkswagen', 'revamps', 'approach', 'china', 'bid', 'overtake', 'upstart', 'ev', 'makers', 'foreign', 'automakers', 'caught', 'flat-footed', 'china', 'electric', 'vehicle', 'boom', 'shaken', 'market', 'last', 'three', 'years', 'beijing', 'auto', 'giant', 'volkswagen', 'ag', 'races', 'catch', 'upstart', 'chinese', 'competitors', 'drivers', 'like', '26-year']",35
"{'id': None, 'name': 'Biztoc.com'}",aol.com,Musk's visit to China was a much-needed win for both sides,"None Elon Musk just made a quick trip to China, where he met with senior officials and struck a deal. • None The Beijing visit comes as trade tensions have ratcheted up between China and the US, including over EVs. • None And Musk notably skipped a recent vis…",https://biztoc.com/x/afa2e90d5875992d,https://c.biztoc.com/p/afa2e90d5875992d/s.webp,2024-04-30T09:44:08Z,"None Elon Musk just made a quick trip to China, where he met with senior officials and struck a deal.None The Beijing visit comes as trade tensions have ratcheted up between China and the US, includi… [+252 chars]",tesla,"Musk's visit to China was a much-needed win for both sides None Elon Musk just made a quick trip to China, where he met with senior officials and struck a deal. • None The Beijing visit comes as trade tensions have ratcheted up between China and the US, including over EVs. • None And Musk notably skipped a recent vis…",319.0,"['musk', 'visit', 'china', 'much-needed', 'win', 'sides', 'none', 'elon', 'musk', 'made', 'quick', 'trip', 'china', 'met', 'senior', 'officials', 'struck', 'deal', 'none', 'beijing', 'visit', 'comes', 'trade', 'tensions', 'ratcheted', 'china', 'us', 'including', 'evs', 'none', 'musk', 'notably', 'skipped', 'recent', 'vis']",35
"{'id': None, 'name': 'CleanTechnica'}",Steve Hanley,Tesla Clears FSD Hurdle In China But System Faces Further Scrutiny In US,"Tesla has won a key approval to roll out its Full Self Driving software suite in China but is facing calls for more regulations in the US, 
The post Tesla Clears FSD Hurdle In China But System Faces Further Scrutiny In US appeared first on CleanTechnica.",https://cleantechnica.com/2024/04/29/tesla-clears-fsd-hurdle-in-china-but-system-faces-further-scrutiny-in-us/,https://cleantechnica.com/wp-content/uploads/2024/04/Tesla-FSD-fail.png,2024-04-29T15:13:10Z,"Sign up for daily news updates from CleanTechnica on email. Or follow us on Google News!
The Beijing auto show is going on this week and Elon Musk made a quick trip to the Chinese capital, but not t… [+8532 chars]",tesla,"Tesla Clears FSD Hurdle In China But System Faces Further Scrutiny In US Tesla has won a key approval to roll out its Full Self Driving software suite in China but is facing calls for more regulations in the US, 
The post Tesla Clears FSD Hurdle In China But System Faces Further Scrutiny In US appeared first on CleanTechnica.",327.0,"['clears', 'fsd', 'hurdle', 'china', 'system', 'faces', 'scrutiny', 'us', 'key', 'approval', 'roll', 'full', 'self', 'driving', 'software', 'suite', 'china', 'facing', 'calls', 'regulations', 'us', 'post', 'clears', 'fsd', 'hurdle', 'china', 'system', 'faces', 'scrutiny', 'us', 'appeared', 'first', 'cleantechnica']",33
"{'id': None, 'name': 'Forbes'}","Billy Bambrough, Senior Contributor, 
 Billy Bambrough, Senior Contributor
 https://www.forbes.com/sites/billybambrough/","X ‘End Goal’ Revealed After Elon Musk Teased A Crypto Payments Bombshell That Could Blow up The Price Of Bitcoin, Ethereum, XRP And Dogecoin","An executive at Musk's social media company X has revealed the platforms payments ""end goal"" that could play havoc with the bitcoin price and wider crypto market...",https://www.forbes.com/sites/digital-assets/2024/04/28/x-end-goal-revealed-after-elon-musk-teased-a-crypto-payments-bombshell-that-could-blow-up-the-price-of-bitcoin-ethereum-xrp-and-dogecoin/,https://imageio.forbes.com/specials-images/imageserve/65a681d8f8e278139e96031d/0x0.jpg?format=jpg&height=900&width=1600&fit=bounds,2024-04-28T12:15:18Z,"Bitcoinalong with other major cryptocurrencies ethereum, XRPXRP
 and dogecoinhave rocketed higher over the last year (and now could be heading into a key week).
Subscribe now to Forbes' CryptoAsset… [+3803 chars]",tesla,"X ‘End Goal’ Revealed After Elon Musk Teased A Crypto Payments Bombshell That Could Blow up The Price Of Bitcoin, Ethereum, XRP And Dogecoin An executive at Musk's social media company X has revealed the platforms payments ""end goal"" that could play havoc with the bitcoin price and wider crypto market...",305.0,"['x', 'end', 'goal', 'revealed', 'elon', 'musk', 'teased', 'crypto', 'payments', 'bombshell', 'could', 'blow', 'price', 'bitcoin', 'ethereum', 'xrp', 'dogecoin', 'executive', 'musk', 'social', 'media', 'company', 'x', 'revealed', 'platforms', 'payments', 'end', 'goal', 'could', 'play', 'havoc', 'bitcoin', 'price', 'wider', 'crypto', 'market']",36
"{'id': None, 'name': 'Forbes'}","Mary Whitfill Roeloffs, Forbes Staff, 
 Mary Whitfill Roeloffs, Forbes Staff
 https://www.forbes.com/sites/maryroeloffs/","Almost 65,000 Job Cuts Were Announced In April—And AI Was Blamed For The Most Losses Ever","Tesla's announcement of 14,000 layoffs made automotive the sector with the most job loss in April.",https://www.forbes.com/sites/maryroeloffs/2024/05/02/almost-65000-job-cuts-were-announced-in-april-and-ai-was-blamed-for-the-most-losses-ever/,"https://imageio.forbes.com/specials-images/imageserve/663289a740c04993f6575e9b/0x0.jpg?format=jpg&crop=929,522,x0,y55,safe&height=900&width=1600&fit=bounds",2024-05-02T11:30:00Z,"Nearly 65,000 people were cut from their jobs at U.S. based companies in April according to a report released Thursday by career services firm Challenger, Gray &amp; Christmas , with continued cuts i… [+2678 chars]",tesla,"Almost 65,000 Job Cuts Were Announced In April—And AI Was Blamed For The Most Losses Ever Tesla's announcement of 14,000 layoffs made automotive the sector with the most job loss in April.",188.0,"['almost', 'job', 'cuts', 'announced', 'april', 'ai', 'blamed', 'losses', 'ever', 'announcement', 'layoffs', 'made', 'automotive', 'sector', 'job', 'loss', 'april']",17
