source,author,title,description,url,urlToImage,publishedAt,content,label,text,length,tokens,num_tokens
"{'id': None, 'name': 'CleanTechnica'}",Zachary Shahan,Tesla “Full Self Driving” Could Come To Other Countries Before Long,"Ever since Tesla started rolling out Full Self Driving (FSD) to non-employee Tesla owners in the US, people in other countries have been asking when they’ll be able to install and use FSD. As far as I remember, it’s always been a vague “someday…” kind of resp…",https://cleantechnica.com/2024/04/23/tesla-full-self-driving-could-come-to-other-countries-before-long/,https://cleantechnica.com/wp-content/uploads/2024/03/Tesla-Model-3-Autostopping-Stop-Light-Autopilot-Full-Self-Driving-CleanTechnica-Stopping-New-FSD.jpeg,2024-04-24T03:55:41Z,"Sign up for daily news updates from CleanTechnica on email. Or follow us on Google News!
Ever since Tesla started rolling out Full Self Driving (FSD) to non-employee Tesla owners in the US, people i… [+3965 chars]",tesla,"Tesla “Full Self Driving” Could Come To Other Countries Before Long Ever since Tesla started rolling out Full Self Driving (FSD) to non-employee Tesla owners in the US, people in other countries have been asking when they’ll be able to install and use FSD. As far as I remember, it’s always been a vague “someday…” kind of resp…",328.0,"['full', 'self', 'driving', 'could', 'come', 'countries', 'long', 'ever', 'since', 'started', 'rolling', 'full', 'self', 'driving', 'fsd', 'non-employee', 'owners', 'us', 'people', 'countries', 'asking', 'able', 'install', 'use', 'fsd', 'far', 'remember', 'always', 'vague', 'someday', 'kind', 'resp']",32
"{'id': None, 'name': 'CleanTechnica'}",Zachary Shahan,More Than 3× As Many Tesla Model Y Sales As Tesla Model 3 Sales In USA In 1st Quarter,"Tesla’s just had a tough quarter, including in the United States, but a tough quarter for Tesla would be a stunning, fantabulous success for any other company trying to sell electric vehicles. In the USA, according to data from Cox Automotive and Kelley Blue …",https://cleantechnica.com/2024/04/19/more-than-3x-as-many-tesla-model-y-sales-as-tesla-model-3-sales-in-usa-in-1st-quarter/,https://cleantechnica.com/wp-content/uploads/2024/02/New-Tesla-Model-Y-Model-3-Model-S-Model-X-Supercharging-Florida-Station-CleanTechnica-Watermark-Sky-logo-800x445.png,2024-04-20T03:57:24Z,"Sign up for daily news updates from CleanTechnica on email. Or follow us on Google News!
Tesla’s just had a tough quarter, including in the United States, but a tough quarter for Tesla would be a st… [+4173 chars]",tesla,"More Than 3× As Many Tesla Model Y Sales As Tesla Model 3 Sales In USA In 1st Quarter Tesla’s just had a tough quarter, including in the United States, but a tough quarter for Tesla would be a stunning, fantabulous success for any other company trying to sell electric vehicles. In the USA, according to data from Cox Automotive and Kelley Blue …",346.0,"['many', 'model', 'sales', 'model', 'sales', 'usa', '1st', 'quarter', 'tough', 'quarter', 'including', 'united', 'states', 'tough', 'quarter', 'would', 'stunning', 'fantabulous', 'success', 'company', 'trying', 'sell', 'electric', 'vehicles', 'usa', 'according', 'data', 'cox', 'automotive', 'kelley', 'blue']",31
"{'id': None, 'name': 'CleanTechnica'}",Paul Fosse,Tesla Surprises Investors With A Tiny Y & A Tiny 3 As Soon As This Year!,"A lot has been written about the Tesla’s next-generation compact car that used to be widely called the Model 2, including Zach’s excellent article last week about it. Zach asked who might pick up the challenge in place of Tesla doing it. Today, Tesla announce…",https://cleantechnica.com/2024/04/23/tesla-surprises-investors-with-a-tiny-y-a-tiny-3-as-soon-as-this-year/,https://cleantechnica.com/wp-content/uploads/2023/12/Apple-Car-Tesla-Model-3-CleanTechnica-Front-Glass-Watermark-Logo-scaled.jpeg,2024-04-24T01:56:23Z,"Sign up for daily news updates from CleanTechnica on email. Or follow us on Google News!
A lot has been written about the Tesla’s next-generation compact car that used to be widely called the Model … [+6014 chars]",tesla,"Tesla Surprises Investors With A Tiny Y & A Tiny 3 As Soon As This Year! A lot has been written about the Tesla’s next-generation compact car that used to be widely called the Model 2, including Zach’s excellent article last week about it. Zach asked who might pick up the challenge in place of Tesla doing it. Today, Tesla announce…",333.0,"['surprises', 'investors', 'tiny', 'tiny', 'soon', 'year', 'lot', 'written', 'next-generation', 'compact', 'car', 'used', 'widely', 'called', 'model', 'including', 'zach', 'excellent', 'article', 'last', 'week', 'zach', 'asked', 'might', 'pick', 'challenge', 'place', 'today', 'announce']",29
"{'id': None, 'name': 'CleanTechnica'}",Carolyn Fortuna,The Revisionist Language That Tesla Used In The Q1 2024 Earnings Call,"The Tesla, Inc. Q1 2024 earnings call was fascinating in how Tesla representatives drew on carefully phrased statements to appease and turn around what was then a largely disgruntled shareholder group. The revisionist language within the earnings call took co…",https://cleantechnica.com/2024/04/26/the-revisionist-language-that-tesla-used-in-the-q1-2024-earnings-call/,https://cleantechnica.com/wp-content/uploads/2023/06/Elon-Musk-CleanTechnica-shirt-Tesla-Model-Y-reveal-watermark.jpeg,2024-04-26T19:24:10Z,"Sign up for daily news updates from CleanTechnica on email. Or follow us on Google News!
The Tesla, Inc. Q1 2024 earnings call was fascinating in how Tesla representatives drew on carefully phrased … [+9089 chars]",tesla,"The Revisionist Language That Tesla Used In The Q1 2024 Earnings Call The Tesla, Inc. Q1 2024 earnings call was fascinating in how Tesla representatives drew on carefully phrased statements to appease and turn around what was then a largely disgruntled shareholder group. The revisionist language within the earnings call took co…",330.0,"['revisionist', 'language', 'used', 'q1', 'earnings', 'call', 'inc', 'q1', 'earnings', 'call', 'fascinating', 'representatives', 'drew', 'carefully', 'phrased', 'statements', 'appease', 'turn', 'around', 'largely', 'disgruntled', 'shareholder', 'group', 'revisionist', 'language', 'within', 'earnings', 'call', 'took', 'co']",30
"{'id': 'techcrunch', 'name': 'TechCrunch'}",Paul Sawers,French startup FlexAI exits stealth with $30M to ease access to AI compute,"A French startup has raised a hefty seed investment to ""rearchitect compute infrastructure"" for developers wanting to build and train AI applications more...",https://techcrunch.com/2024/04/23/french-startup-flexai-exits-stealth-with-30m-to-ease-access-to-ai-compute/,https://s.yimg.com/ny/api/res/1.2/V7FcJP2rJb.YNXWOmWjLrw--/YXBwaWQ9aGlnaGxhbmRlcjt3PTEyMDA7aD02NzQ-/https://media.zenfs.com/en/techcrunch_350/128964a889f3f6262e9e1f768561ec69,2024-04-24T05:37:28Z,"A French startup has raised a hefty seed investment to ""rearchitect compute infrastructure"" for developers wanting to build and train AI applications more efficiently.
FlexAI, as the company is call… [+10420 chars]",tesla,"French startup FlexAI exits stealth with $30M to ease access to AI compute A French startup has raised a hefty seed investment to ""rearchitect compute infrastructure"" for developers wanting to build and train AI applications more...",232.0,"['french', 'startup', 'flexai', 'exits', 'stealth', '30m', 'ease', 'access', 'ai', 'compute', 'french', 'startup', 'raised', 'hefty', 'seed', 'investment', 'rearchitect', 'compute', 'infrastructure', 'developers', 'wanting', 'build', 'train', 'ai', 'applications']",25
"{'id': None, 'name': 'CleanTechnica'}",Chris Boylan,Tesla Retreats When It Should be Advancing,"With Tesla’s lackluster performance in Q1 for EV deliveries, one would think the company would pull out all the stops to stimulate demand. And they have started taking the most basic measure, which is seemingly the only one in Elon’s arsenal: slash prices. Te…",https://cleantechnica.com/2024/04/21/tesla-retreats-when-it-should-advance/,https://cleantechnica.com/wp-content/uploads/2024/04/Tesla-Advance-featured.jpg,2024-04-22T03:37:08Z,"Sign up for daily news updates from CleanTechnica on email. Or follow us on Google News!
With Tesla’s lackluster performance in Q1 for EV deliveries, one would think the company would pull out all t… [+5671 chars]",tesla,"Tesla Retreats When It Should be Advancing With Tesla’s lackluster performance in Q1 for EV deliveries, one would think the company would pull out all the stops to stimulate demand. And they have started taking the most basic measure, which is seemingly the only one in Elon’s arsenal: slash prices. Te…",303.0,"['retreats', 'advancing', 'lackluster', 'performance', 'q1', 'ev', 'deliveries', 'one', 'would', 'think', 'company', 'would', 'pull', 'stops', 'stimulate', 'demand', 'started', 'taking', 'basic', 'measure', 'seemingly', 'one', 'elon', 'arsenal', 'slash', 'prices', 'te']",27
"{'id': None, 'name': 'Fark.com'}",,"""Wife of Doctor Who Drove Tesla Off Cliff Asks Court to Spare Him Prison"". Wait, Doctor Who drove a Tesla off a cliff? Must have been a Twelfth Doctor episode [Asinine]","""Wife of Doctor Who Drove Tesla Off Cliff Asks Court to Spare Him Prison"". Wait, Doctor Who drove a Tesla off a cliff? Must have been a Twelfth Doctor episode",https://www.fark.com/comments/13242136/Wife-of-Doctor-Who-Drove-Tesla-Off-Cliff-Asks-Court-to-Spare-Him-Prison-Wait-Doctor-Who-drove-a-Tesla-off-a-cliff-Must-have-been-a-Twelfth-Doctor-episode,https://usrimg-full.fark.net/l/lK/fark_lKtuoI-Nab1W3c1dMvEoBJplMag.jpg?AWSAccessKeyId=JO3ELGV4BGLFW7Y3EZXN&Expires=1714968000&Signature=IVephGcp1z1MNnyl5d%2BwJ7mf7j8%3D,2024-05-04T07:05:38Z,"<li>Links are submitted by members of the Fark community.
</li><li>When community members submit a link, they also write a custom headline for the story.
</li><li>Other Farkers comment on the links… [+177 chars]",tesla,"""Wife of Doctor Who Drove Tesla Off Cliff Asks Court to Spare Him Prison"". Wait, Doctor Who drove a Tesla off a cliff? Must have been a Twelfth Doctor episode [Asinine] ""Wife of Doctor Who Drove Tesla Off Cliff Asks Court to Spare Him Prison"". Wait, Doctor Who drove a Tesla off a cliff? Must have been a Twelfth Doctor episode",327.0,"['wife', 'doctor', 'drove', 'cliff', 'asks', 'court', 'spare', 'prison', 'wait', 'doctor', 'drove', 'cliff', 'must', 'twelfth', 'doctor', 'episode', 'asinine', 'wife', 'doctor', 'drove', 'cliff', 'asks', 'court', 'spare', 'prison', 'wait', 'doctor', 'drove', 'cliff', 'must', 'twelfth', 'doctor', 'episode']",33
"{'id': None, 'name': 'CleanTechnica'}",Zachary Shahan,"Tesla Reaches 1,000 Cybertrucks Produced A Week","There have been a lot of questions about the Tesla Cybertruck’s mass-production potential since the truck was first shown, and we’re clearly in a kind of “production hell” period of the Cybertruck ramp-up. Recently, production was paused and a recall issued b…",https://cleantechnica.com/2024/04/23/tesla-reaches-1000-cybertrucks-produced-a-week/,https://cleantechnica.com/wp-content/uploads/2024/04/Tesla-Cybertruck-production-line.png,2024-04-24T03:50:14Z,"Sign up for daily news updates from CleanTechnica on email. Or follow us on Google News!
There have been a lot of questions about the Tesla Cybertruck’s mass-production potential since the truck was… [+1854 chars]",tesla,"Tesla Reaches 1,000 Cybertrucks Produced A Week There have been a lot of questions about the Tesla Cybertruck’s mass-production potential since the truck was first shown, and we’re clearly in a kind of “production hell” period of the Cybertruck ramp-up. Recently, production was paused and a recall issued b…",308.0,"['reaches', 'cybertrucks', 'produced', 'week', 'lot', 'questions', 'cybertruck', 'mass-production', 'potential', 'since', 'truck', 'first', 'shown', 'clearly', 'kind', 'production', 'hell', 'period', 'cybertruck', 'ramp-up', 'recently', 'production', 'paused', 'recall', 'issued', 'b']",26
"{'id': None, 'name': 'CleanTechnica'}",Zachary Shahan,Pros & Cons of Tesla Supercharging Changes,"As you’ve surely heard, Tesla has laid off 500 employees in the Supercharging division, the majority of its Supercharger team. Upon the sudden news, various reasons were put forth for why Elon Musk might have laid them all off. Reportedly, the core reason was…",https://cleantechnica.com/2024/05/02/pros-cons-of-tesla-supercharging-changes/,https://cleantechnica.com/wp-content/uploads/2024/04/Tesla-location-service-fleet-Supercharger-growth-logo-copy.png,2024-05-02T12:52:16Z,"Sign up for daily news updates from CleanTechnica on email. Or follow us on Google News!
As you’ve surely heard, Tesla has laid off 500 employees in the Supercharging division, the majority of its S… [+6996 chars]",tesla,"Pros & Cons of Tesla Supercharging Changes As you’ve surely heard, Tesla has laid off 500 employees in the Supercharging division, the majority of its Supercharger team. Upon the sudden news, various reasons were put forth for why Elon Musk might have laid them all off. Reportedly, the core reason was…",303.0,"['pros', 'cons', 'supercharging', 'changes', 'surely', 'heard', 'laid', 'employees', 'supercharging', 'division', 'majority', 'supercharger', 'team', 'upon', 'sudden', 'news', 'various', 'reasons', 'put', 'forth', 'elon', 'musk', 'might', 'laid', 'reportedly', 'core', 'reason']",27
"{'id': None, 'name': 'Etf.com'}",Sumit Roy,TSLL Surges 86%. Will it Keep Rallying?,The leveraged Tesla ETF jumped on Monday on word that Tesla would roll out FSD in China.,http://www.etf.com/sections/news/tsll-surges-68-will-it-keep-rallying?utm_source=yahoo-finance&utm_medium=rss&utm_campaign=yahoo-finance-rss,https://s.yimg.com/ny/api/res/1.2/fbmh55TQuGxyG1i7iOSmug--/YXBwaWQ9aGlnaGxhbmRlcjt3PTEyMDA7aD02NzU-/https://media.zenfs.com/en/indexuniverse.com/8b7973db41d50f3454f3f3057f86198c,2024-04-29T20:04:03Z,"TSLL Surges 68%. Will it Keep Rallying?
Shares of Tesla Inc. soared 18% on Monday, adding to their massive gains from last week and boosting exchange-traded funds holding the company's stock, as the… [+1766 chars]",tesla,TSLL Surges 86%. Will it Keep Rallying? The leveraged Tesla ETF jumped on Monday on word that Tesla would roll out FSD in China.,128.0,"['tsll', 'surges', 'keep', 'rallying', 'leveraged', 'etf', 'jumped', 'monday', 'word', 'would', 'roll', 'fsd', 'china']",13
"{'id': None, 'name': 'Slate Magazine'}","Emily Peck, Felix Salmon, and Elizabeth Spiers",Elon Musk Wants His Payday,Elon Musk is bad for Tesla. Why does it want to pay $56 billion to keep him?,https://slate.com/podcasts/slate-money/2024/04/business-tesla-wants-to-keep-elon-musk-and-musk-wants-a-big-payday,https://compote.slate.com/images/0ad4cce0-1643-405e-b092-a65cc2f24b9e.jpeg?crop=1560%2C1040%2Cx0%2Cy0&width=1560,2024-04-20T09:00:00Z,"This week: Elon Musk wants his colossal, court-blocked pay package, and Teslas board wants to give it to him. Felix Salmon, Emily Peck, and Elizabeth Spiers also chat with Alicia Montgomery, current … [+578 chars]",tesla,Elon Musk Wants His Payday Elon Musk is bad for Tesla. Why does it want to pay $56 billion to keep him?,103.0,"['elon', 'musk', 'wants', 'payday', 'elon', 'musk', 'bad', 'want', 'pay', 'billion', 'keep']",11
"{'id': None, 'name': 'BMWBLOG'}",Adrian Padeanu,The New Tesla Model 3 Performance Rivals The 2025 BMW i4 M50,"We’re mere hours away from the world premiere of the 2025 i4 M50 but Tesla is beating BMW to the punch with its own update for the Model 3 Performance. It inherits the subtle design...
First published by https://www.bmwblog.com",https://www.bmwblog.com/2024/04/23/new-tesla-model-3-performance/,https://cdn.bmwblog.com/wp-content/uploads/2024/04/Tesla-Model-3-Performance-7.jpg,2024-04-23T17:28:07Z,Were mere hours away from the world premiere of the 2025 i4 M50 but Tesla is beating BMW to the punch with its own update for the Model 3 Performance. It inherits the subtle design revisions of the r… [+1862 chars],tesla,"The New Tesla Model 3 Performance Rivals The 2025 BMW i4 M50 We’re mere hours away from the world premiere of the 2025 i4 M50 but Tesla is beating BMW to the punch with its own update for the Model 3 Performance. It inherits the subtle design...
First published by https://www.bmwblog.com",288.0,"['new', 'model', 'performance', 'rivals', 'bmw', 'i4', 'm50', 'mere', 'hours', 'away', 'world', 'premiere', 'i4', 'm50', 'beating', 'bmw', 'punch', 'update', 'model', 'performance', 'inherits', 'subtle', 'design', 'first', 'published', 'https', 'www', 'bmwblog', 'com']",29
"{'id': 'bbc-news', 'name': 'BBC News'}",BBC Radio 4,Nikola Tesla,Melvyn Bragg and guests discuss the Serbian-American inventor Nikola Tesla (1856-1943) and his role in the development of electrical systems towards the end of the nineteenth century. He made his name in New York in the contest over which current should flow …,https://www.bbc.co.uk/programmes/m001xvhb,https://ichef.bbci.co.uk/images/ic/1200x675/p0h5bdr7.jpg,2024-05-02T09:15:00Z,Melvyn Bragg and guests discuss the Serbian-American inventor Nikola Tesla (1856-1943) and his role in the development of electrical systems towards the end of the nineteenth century. He made his nam… [+1895 chars],tesla,Nikola Tesla Melvyn Bragg and guests discuss the Serbian-American inventor Nikola Tesla (1856-1943) and his role in the development of electrical systems towards the end of the nineteenth century. He made his name in New York in the contest over which current should flow …,273.0,"['nikola', 'melvyn', 'bragg', 'guests', 'discuss', 'serbian-american', 'inventor', 'nikola', 'role', 'development', 'electrical', 'systems', 'towards', 'end', 'nineteenth', 'century', 'made', 'name', 'new', 'york', 'contest', 'current', 'flow']",23
"{'id': None, 'name': 'redmondpie.com'}",Oliver Haslam,"New Off-Road Cybertruck Features Detailed, Including CyberTent, More","New off-road Cybertruck features have just been detailed, including a new CyberTent mode, and more. Here are all the details.
The post New Off-Road Cybertruck Features Detailed, Including CyberTent, More first appeared on Redmond Pie.",https://www.redmondpie.com/new-off-road-cybertruck-features-detailed-including-cybertent-more/,https://cdn.redmondpie.com/wp-content/uploads/2024/04/offroad.jpg,2024-04-29T18:14:44Z,"Tesla has announced a new Cybertruck software update that is going to add new off-roading capabilities to the electric truck, including CyberTent mode.
The Cybertruck has been available for a couple… [+1759 chars]",tesla,"New Off-Road Cybertruck Features Detailed, Including CyberTent, More New off-road Cybertruck features have just been detailed, including a new CyberTent mode, and more. Here are all the details.
The post New Off-Road Cybertruck Features Detailed, Including CyberTent, More first appeared on Redmond Pie.",303.0,"['new', 'off-road', 'cybertruck', 'features', 'detailed', 'including', 'cybertent', 'new', 'off-road', 'cybertruck', 'features', 'detailed', 'including', 'new', 'cybertent', 'mode', 'details', 'post', 'new', 'off-road', 'cybertruck', 'features', 'detailed', 'including', 'cybertent', 'first', 'appeared', 'redmond', 'pie']",29
"{'id': None, 'name': 'Daily Beast'}",Kate Briquelet,‘I’m Still in Denial’: Tesla Layoffs Leave Interns High and Dry,"Peter Cziborra/Reuters 
One New York college student was ready to spend the summer in Palo Alto with Tesla’s engineering HR team. Another from Michigan spent thousands on housing for an internship in Austin, Texas, to work with the electric automaker’s firmw…",https://www.thedailybeast.com/im-still-in-denial-tesla-layoffs-leave-interns-high-and-dry,"https://img.thedailybeast.com/image/upload/c_crop,d_placeholder_euli9k,h_2685,w_4773,x_184,y_0/dpr_2.0/c_limit,w_740/fl_lossy,q_auto/v1714783841/2024-04-26T102511Z_760980285_RC2YU6AXLBAJ_RTRMADP_3_TESLA-AUTOPILOT-INVESTIGATION_ynwciq",2024-05-04T00:58:29Z,"One New York college student was ready to spend the summer in Palo Alto with Teslas engineering HR team. Another from Michigan spent thousands on housing for an internship in Austin, Texas, to work w… [+7425 chars]",tesla,"‘I’m Still in Denial’: Tesla Layoffs Leave Interns High and Dry Peter Cziborra/Reuters 
One New York college student was ready to spend the summer in Palo Alto with Tesla’s engineering HR team. Another from Michigan spent thousands on housing for an internship in Austin, Texas, to work with the electric automaker’s firmw…",324.0,"['still', 'denial', 'layoffs', 'leave', 'interns', 'high', 'dry', 'peter', 'cziborra', 'reuters', 'one', 'new', 'york', 'college', 'student', 'ready', 'spend', 'summer', 'palo', 'alto', 'engineering', 'hr', 'team', 'another', 'michigan', 'spent', 'thousands', 'housing', 'internship', 'austin', 'texas', 'work', 'electric', 'automaker', 'firmw']",35
"{'id': None, 'name': ""Paul Tan's Automotive News""}",Paul Tan,Tesla Cybertruck on display to public at Pavilion Damansara Heights showroom until May 17,"Tesla Malaysia has announced that the Tesla Cybertruck will be on display to members of the public at the Tesla Experience Centre Pavilion Damansara Heights starting from tomorrow (April 30 2024) up to May 17 […]
The post Tesla Cybertruck on display to public…",https://paultan.org/2024/04/29/tesla-cybertruck-on-display-to-public-at-pavilion-damansara-heights-showroom-until-may-17/,https://paultan.org/image/2024/04/Snapinsta.app_440923715_444863994752220_8380656726953920538_n_1080-630x419.jpg,2024-04-29T12:13:15Z,Tesla Malaysia has announced that the Tesla Cybertruck will be on display to members of the public at the Tesla Experience Centre Pavilion Damansara Heights starting from tomorrow (April 30 2024) up … [+1982 chars],tesla,"Tesla Cybertruck on display to public at Pavilion Damansara Heights showroom until May 17 Tesla Malaysia has announced that the Tesla Cybertruck will be on display to members of the public at the Tesla Experience Centre Pavilion Damansara Heights starting from tomorrow (April 30 2024) up to May 17 […]
The post Tesla Cybertruck on display to public…",350.0,"['cybertruck', 'display', 'public', 'pavilion', 'damansara', 'heights', 'showroom', 'may', 'malaysia', 'announced', 'cybertruck', 'display', 'members', 'public', 'experience', 'centre', 'pavilion', 'damansara', 'heights', 'starting', 'tomorrow', 'april', 'may', 'post', 'cybertruck', 'display', 'public']",27
"{'id': 'rt', 'name': 'RT'}",RT,Tesla stock soars on China deal rumors,"Tesla CEO Elon Musk has reportedly taken steps toward bringing autopilot software to China, causing shares in the automaker to surge Read Full Article at RT.com",https://www.rt.com/business/596758-tesla-shares-china-autopilot-musk/,https://mf.b37mrtl.ru/files/2024.04/article/662fafb520302717c8371c65.jpg,2024-04-29T14:29:56Z,Shares in Tesla have surged following reports that CEO Elon Musk has agreed to partner with Chinese tech giant Baidu for mapping and navigation features to support autonomous driving technology in th… [+2499 chars],tesla,"Tesla stock soars on China deal rumors Tesla CEO Elon Musk has reportedly taken steps toward bringing autopilot software to China, causing shares in the automaker to surge Read Full Article at RT.com",199.0,"['stock', 'soars', 'china', 'deal', 'rumors', 'ceo', 'elon', 'musk', 'reportedly', 'taken', 'steps', 'toward', 'bringing', 'autopilot', 'software', 'china', 'causing', 'shares', 'automaker', 'surge', 'read', 'full', 'article', 'rt', 'com']",25
"{'id': None, 'name': 'Windows Central'}",samuelwtolbert@gmail.com (Samuel Tolbert),"PSA: Fallout 4 next-gen update is now available on Xbox, PlayStation and Windows PC","The current-generation upgrade for Fallout 4 is finally available, bringing improved visual modes, new features, bug fixes, and more to players on Xbox Series X|S, Windows PC, and PlayStation 5.",https://www.windowscentral.com/gaming/xbox/psa-fallout-4-current-generation-update-is-now-available-on-xbox-and-windows-pc,https://cdn.mos.cms.futurecdn.net/Vvt2QJg9ztAQbLJDUK7r54-1200-80.png,2024-04-25T15:26:19Z,"What you need to know
<ul><li>Fallout 4's current-generation upgrade is available now on Xbox Series X|S, Windows PC, and PlayStation. </li><li>This update is free for anyone that already owns the g… [+5186 chars]",tesla,"PSA: Fallout 4 next-gen update is now available on Xbox, PlayStation and Windows PC The current-generation upgrade for Fallout 4 is finally available, bringing improved visual modes, new features, bug fixes, and more to players on Xbox Series X|S, Windows PC, and PlayStation 5.",278.0,"['psa', 'fallout', 'next-gen', 'update', 'available', 'xbox', 'playstation', 'windows', 'pc', 'current-generation', 'upgrade', 'fallout', 'finally', 'available', 'bringing', 'improved', 'visual', 'modes', 'new', 'features', 'bug', 'fixes', 'players', 'xbox', 'series', 'x', 'windows', 'pc', 'playstation']",29
